{
  "schemaVersion": 1,
  "generatedAt": "2026-04-28T21:48:14.937977+00:00",
  "generator": "cowork-btinspect/2.2",
  "sourceFolder": "MBC",
  "project": {
    "name": "MBC Creativity & Arts Centre",
    "siteAddress": "Moreton Bay College, 450 Wondall Road, Manly West, QLD 4179",
    "jobNumber": "2024.0230",
    "client": "Moreton Bay College",
    "issueStatus": "TENDER NOT FOR CONSTRUCTION",
    "engineerOfRecord": "Bligh Tanner",
    "discipline": "structural",
    "builder": null,
    "architect": null,
    "rpeqSignatory": null,
    "excludedFromBT": [
      {
        "element": "Structural steelwork — temporary propping & bracing",
        "responsibility": "Contractor RPEQ (temporary works engineer)",
        "noteRef": "S18 & G2",
        "scope": "Temporary works during erection"
      },
      {
        "element": "Light-gauge steel stud framing",
        "responsibility": "Manufacturer RPEQ (Form 16 on completion)",
        "noteRef": "ST1",
        "scope": "Sizing, spacing, and ALL connections to permanent structure"
      },
      {
        "element": "Roof safety systems",
        "responsibility": "Manufacturer / supplier",
        "noteRef": "(general note table)",
        "scope": "System and connections to roof, including verification of load paths to permanent bracing"
      }
    ]
  },
  "sourceFiles": [
    {
      "filename": "MBC.pdf",
      "pageCount": 62,
      "sizeBytes": 99113288,
      "sha256": null
    }
  ],
  "drawings": [
    {
      "sourceFile": "MBC.pdf",
      "pageNumber": 1,
      "sheetNumber": "S000",
      "revision": "T2",
      "revisionDate": null,
      "description": "COVER SHEET",
      "scale": null,
      "drawnBy": "SN",
      "checkedBy": null,
      "approvedBy": "DM",
      "tags": [
        "kind:cover",
        "level:na"
      ],
      "applicableInspectionTypes": [],
      "elements": [],
      "confidence": 1.0
    },
    {
      "sourceFile": "MBC.pdf",
      "pageNumber": 2,
      "sheetNumber": "S001",
      "revision": "T2",
      "revisionDate": null,
      "description": "GENERAL NOTES - SHEET 1",
      "scale": null,
      "drawnBy": "SN",
      "checkedBy": null,
      "approvedBy": "DM",
      "tags": [
        "kind:notes",
        "level:na"
      ],
      "applicableInspectionTypes": [],
      "elements": [],
      "confidence": 0.85
    },
    {
      "sourceFile": "MBC.pdf",
      "pageNumber": 3,
      "sheetNumber": "S002",
      "revision": "T2",
      "revisionDate": null,
      "description": "GENERAL NOTES - SHEET 2",
      "scale": null,
      "drawnBy": "SN",
      "checkedBy": null,
      "approvedBy": "DM",
      "tags": [
        "kind:notes",
        "level:na"
      ],
      "applicableInspectionTypes": [],
      "elements": [],
      "confidence": 0.85
    },
    {
      "sourceFile": "MBC.pdf",
      "pageNumber": 4,
      "sheetNumber": null,
      "revision": null,
      "revisionDate": null,
      "description": null,
      "scale": null,
      "drawnBy": null,
      "checkedBy": null,
      "approvedBy": null,
      "tags": [
        "kind:plan",
        "level:multi"
      ],
      "applicableInspectionTypes": [],
      "elements": [],
      "confidence": 0.3
    },
    {
      "sourceFile": "MBC.pdf",
      "pageNumber": 5,
      "sheetNumber": "S010",
      "revision": "T2",
      "revisionDate": null,
      "description": "FOOTING PLAN NOTES, LEGENDS, & SCHEDULES",
      "scale": null,
      "drawnBy": "SN",
      "checkedBy": null,
      "approvedBy": "DM",
      "tags": [
        "element:pad-footing",
        "kind:notes",
        "level:ground"
      ],
      "applicableInspectionTypes": [
        "pad-footing-prepour",
        "pile-bored-install",
        "subgrade"
      ],
      "elements": [],
      "confidence": 1.0
    },
    {
      "sourceFile": "MBC.pdf",
      "pageNumber": 6,
      "sheetNumber": "S011",
      "revision": "T2",
      "revisionDate": null,
      "description": "FOOTING AND PLANT SLAB PLAN",
      "scale": null,
      "drawnBy": "SN",
      "checkedBy": null,
      "approvedBy": "DM",
      "tags": [
        "element:pad-footing",
        "element:slab-on-ground",
        "kind:plan",
        "level:ground"
      ],
      "applicableInspectionTypes": [
        "pad-footing-prepour",
        "pile-bored-install",
        "slab-prepour-ground",
        "subgrade"
      ],
      "elements": [],
      "confidence": 1.0
    },
    {
      "sourceFile": "MBC.pdf",
      "pageNumber": 7,
      "sheetNumber": "S015",
      "revision": "T2",
      "revisionDate": null,
      "description": "FOOTING DETAILS - SHEET 1",
      "scale": null,
      "drawnBy": "SN",
      "checkedBy": null,
      "approvedBy": "DM",
      "tags": [
        "element:pad-footing",
        "kind:detail",
        "level:ground"
      ],
      "applicableInspectionTypes": [
        "pad-footing-prepour",
        "pile-bored-install",
        "subgrade"
      ],
      "elements": [],
      "confidence": 0.85
    },
    {
      "sourceFile": "MBC.pdf",
      "pageNumber": 8,
      "sheetNumber": "S016",
      "revision": "T2",
      "revisionDate": null,
      "description": "FOOTING DETAILS - SHEET 2",
      "scale": null,
      "drawnBy": "SN",
      "checkedBy": null,
      "approvedBy": "DM",
      "tags": [
        "element:pad-footing",
        "kind:detail",
        "level:ground"
      ],
      "applicableInspectionTypes": [
        "pad-footing-prepour",
        "pile-bored-install",
        "subgrade"
      ],
      "elements": [],
      "confidence": 0.85
    },
    {
      "sourceFile": "MBC.pdf",
      "pageNumber": 9,
      "sheetNumber": "S020",
      "revision": "T2",
      "revisionDate": null,
      "description": "TYPICAL CONCRETE WALL DETAILS - SHEET 1",
      "scale": null,
      "drawnBy": "SN",
      "checkedBy": null,
      "approvedBy": "DM",
      "tags": [
        "element:concrete-wall",
        "kind:typical-detail",
        "level:na"
      ],
      "applicableInspectionTypes": [
        "concrete-wall-prepour"
      ],
      "elements": [],
      "confidence": 0.85
    },
    {
      "sourceFile": "MBC.pdf",
      "pageNumber": 10,
      "sheetNumber": "S025",
      "revision": "T2",
      "revisionDate": null,
      "description": "TYPICAL BLOCK WALL DETAILS",
      "scale": null,
      "drawnBy": "SN",
      "checkedBy": null,
      "approvedBy": "DM",
      "tags": [
        "element:block-wall",
        "kind:typical-detail",
        "level:na"
      ],
      "applicableInspectionTypes": [
        "blockwork-core-fill",
        "blockwork-wall-reinf"
      ],
      "elements": [],
      "confidence": 0.85
    },
    {
      "sourceFile": "MBC.pdf",
      "pageNumber": 11,
      "sheetNumber": "S026",
      "revision": "T2",
      "revisionDate": null,
      "description": "TYPICAL BLOCK RETAINING WALL",
      "scale": null,
      "drawnBy": "SN",
      "checkedBy": null,
      "approvedBy": "DM",
      "tags": [
        "kind:plan",
        "level:multi"
      ],
      "applicableInspectionTypes": [
        "blockwork-core-fill",
        "blockwork-wall-reinf"
      ],
      "elements": [],
      "confidence": 1.0
    },
    {
      "sourceFile": "MBC.pdf",
      "pageNumber": 12,
      "sheetNumber": "S027",
      "revision": "T2",
      "revisionDate": null,
      "description": "TYPICAL BLOCK RETAINING WALL",
      "scale": null,
      "drawnBy": "SN",
      "checkedBy": null,
      "approvedBy": "DM",
      "tags": [
        "kind:plan",
        "level:multi"
      ],
      "applicableInspectionTypes": [
        "blockwork-core-fill",
        "blockwork-wall-reinf"
      ],
      "elements": [],
      "confidence": 1.0
    },
    {
      "sourceFile": "MBC.pdf",
      "pageNumber": 13,
      "sheetNumber": "S035",
      "revision": "T2",
      "revisionDate": null,
      "description": "CONCRETE COLUMN DETAILS - SHEET 1",
      "scale": null,
      "drawnBy": "SN",
      "checkedBy": null,
      "approvedBy": "DM",
      "tags": [
        "element:concrete-column",
        "kind:detail",
        "level:multi"
      ],
      "applicableInspectionTypes": [
        "column-prepour"
      ],
      "elements": [],
      "confidence": 0.85
    },
    {
      "sourceFile": "MBC.pdf",
      "pageNumber": 14,
      "sheetNumber": "S040",
      "revision": "T2",
      "revisionDate": null,
      "description": "ATRIUM STAIRS FRAMING LAYOUT",
      "scale": null,
      "drawnBy": "SN",
      "checkedBy": null,
      "approvedBy": "DM",
      "tags": [
        "element:stair",
        "element:steel-beam",
        "kind:plan",
        "level:multi"
      ],
      "applicableInspectionTypes": [
        "stair-prepour"
      ],
      "elements": [],
      "confidence": 1.0
    },
    {
      "sourceFile": "MBC.pdf",
      "pageNumber": 15,
      "sheetNumber": "S041",
      "revision": "T2",
      "revisionDate": null,
      "description": "ATRIUM STAIRS FRAMING SECTIONS",
      "scale": null,
      "drawnBy": "SN",
      "checkedBy": null,
      "approvedBy": "DM",
      "tags": [
        "element:stair",
        "element:steel-beam",
        "kind:section",
        "level:multi"
      ],
      "applicableInspectionTypes": [
        "stair-prepour"
      ],
      "elements": [],
      "confidence": 0.85
    },
    {
      "sourceFile": "MBC.pdf",
      "pageNumber": 16,
      "sheetNumber": "S045",
      "revision": "T2",
      "revisionDate": null,
      "description": "STAIR DETAILS - SHEET 1",
      "scale": null,
      "drawnBy": "SN",
      "checkedBy": null,
      "approvedBy": "DM",
      "tags": [
        "element:stair",
        "kind:detail",
        "level:multi"
      ],
      "applicableInspectionTypes": [
        "stair-prepour"
      ],
      "elements": [],
      "confidence": 0.85
    },
    {
      "sourceFile": "MBC.pdf",
      "pageNumber": 17,
      "sheetNumber": "S050",
      "revision": "T2",
      "revisionDate": null,